ราชินี,แขวงพระบรมมหาราชวัง เขตพระนคร กรุงเทพมหานคร 10200,เขตพื้นที่การศึกษากรุงเทพมหานคร เขต 1
ราชวินิต,แขวงดุสิต เขตดุสิต กรุงเทพมหานคร 10300,เขตพื้นที่การศึกษากรุงเทพมหานคร เขต 1
ราขวัตรวิทยา,แขวงดุสิต เขตดุสิต กรุงเทพมหานคร 10300,เขตพื้นที่การศึกษากรุงเทพมหานคร เขต 1
ราชวินิต มัธยม,แขวงสวนจิตรลดา เขตดุสิต กรุงเทพมหานคร 10300,เขตพื้นที่การศึกษากรุงเทพมหานคร เขต 1
ราชินีบน,เขตดุสิต กรุงเทพมหานคร 10300,เขตพื้นที่การศึกษากรุงเทพมหานคร เขต 1
ระเบียบศึกษา,แขวงคลองถนน เขตบางเขน กรุงเทพมหานคร 10220,เขตพื้นที่การศึกษากรุงเทพมหานคร เขต 2
รัตนโกสินทร์สมโภช บางเขน,แขวงท่าแร้ง เขตบางเขน กรุงเทพมหานคร 10220,เขตพื้นที่การศึกษากรุงเทพมหานคร เขต 2
รุ่งเรืองวิทยา,แขวงบางนา เขตพระโขนง กรุงเทพมหานคร 10260,เขตพื้นที่การศึกษากรุงเทพมหานคร เขต 1
รัตนโกสินทร์สมโภช ลาดกระบัง,แขวงคลองสองต้นนุ่น เขตลาดกระบัง กรุงเทพมหานคร 10520,เขตพื้นที่การศึกษากรุงเทพมหานคร เขต 2
รุจิเสรีวิทยา,แขวงสามเสนใน เขตพญาไท กรุงเทพมหานคร 10400,เขตพื้นที่การศึกษากรุงเทพมหานคร เขต 1
รุ่งอรุณ,แขวงท่าข้าม เขตบางขุนเทียน กรุงเทพมหานคร 10150,เขตพื้นที่การศึกษากรุงเทพมหานคร เขต 3
รัตนโกสินทร์สมโภชบางขุนเทียน,แขวงแสมดำ เขตบางขุนเทียน กรุงเทพมหานคร 10150,เขตพื้นที่การศึกษากรุงเทพมหานคร เขต 3
รัตนกุลอนุบาล,แขวงบางอ้อ เขตบางพลัด กรุงเทพมหานคร 10700,เขตพื้นที่การศึกษากรุงเทพมหานคร เขต 3
ราชนันทาจารย์สามเสนวิทยาลัย 2,แขวงบางซื่อ เขตบางซื่อ กรุงเทพมหานคร 10800,เขตพื้นที่การศึกษากรุงเทพมหานคร เขต 1
รัตนวิทยาบางซื่อ,แขวงบางซื่อ เขตบางซื่อ กรุงเทพมหานคร 10800,เขตพื้นที่การศึกษากรุงเทพมหานคร เขต 1
รักษาราชวิตร,แขวงบางคอแหลม เขตบางคอแหลม กรุงเทพมหานคร 10120,เขตพื้นที่การศึกษากรุงเทพมหานคร เขต 0
ราชดำริ,แขวงดอกไม้ เขตประเวศ กรุงเทพมหานคร 10250,เขตพื้นที่การศึกษากรุงเทพมหานคร เขต 2
ราชวินิตประถมบางแค,แขวงบางแคเหนือ เขตบางแค กรุงเทพมหานคร 10160,เขตพื้นที่การศึกษากรุงเทพมหานคร เขต 0
ราชวินิตบางแคปานขำ,แขวงบางแคเหนือ เขตบางแค กรุงเทพมหานคร 10160,เขตพื้นที่การศึกษากรุงเทพมหานคร เขต 3
ราชวินิตบางเขน,แขวงทุ่งสองห้อง เขตหลักสี่ กรุงเทพมหานคร 10210,เขตพื้นที่การศึกษากรุงเทพมหานคร เขต 2
ราชวินิตบางแก้ว,ต.บางแก้ว อ.บางพลี จ.สมุทรปราการ 10540,เขตพื้นที่การศึกษาสมุทรปราการ เขต 2
ราชประชาสมาสัยในพระบรมราชูปถัมภ์,ต.บางจาก อ.พระประแดง จ.สมุทรปราการ 10130,เขตพื้นที่การศึกษาสมุทรปราการ เขต 1
รัตนโกสินทร์ 9,ต.บางเสาธง อ.บางเสาธง จ.สมุทรปราการ 10540,เขตพื้นที่การศึกษาสมุทรปราการ เขต 2
รัตนาธิเบศร์,ต.สวนใหญ่ อ.เมืองนนทบุรี จ.นนทบุรี 11000,เขตพื้นที่การศึกษานนทบุรี เขต 1
รุ่งโรจน์ศึกษา,ต.ท่าทราย อ.เมืองนนทบุรี จ.นนทบุรี 11000,เขตพื้นที่การศึกษานนทบุรี เขต 1
รัตนบัณฑิตวิทยา,ต.บางสีทอง อ.บางกรวย จ.นนทบุรี 11130,เขตพื้นที่การศึกษานนทบุรี เขต 1
ระดิ่งหินประชาสรรค์,ต.พิมลราช อ.บางบัวทอง จ.นนทบุรี 11110,เขตพื้นที่การศึกษานนทบุรี เขต 0
ราษฏร์นิยม,ต.ราษฎร์นิยม อ.ไทรน้อย จ.นนทบุรี 11150,เขตพื้นที่การศึกษานนทบุรี เขต 2
รุ่งเรืองวิทยา,ต.ท่าอิฐ อ.ปากเกร็ด จ.นนทบุรี 11120,เขตพื้นที่การศึกษานนทบุรี เขต 2
รังสิตวิทยา,ต.บางพูน อ.เมืองปทุมธานี จ.ปทุมธานี 12000,เขตพื้นที่การศึกษาปทุมธานี เขต 1
รัตนโกสินทร์-รังสิต,ต.ประชาธิปัตย์ อ.ธัญบุรี จ.ปทุมธานี 12130,เขตพื้นที่การศึกษาปทุมธานี เขต 2
ราษฎร์สงเคราะห์วิทยา,ต.หนองสามวัง อ.หนองเสือ จ.ปทุมธานี 12170,เขตพื้นที่การศึกษาปทุมธานี เขต 2
ระเบียบวิทยา,ต.คูคต อ.ลำลูกกา จ.ปทุมธานี 12130,เขตพื้นที่การศึกษาปทุมธานี เขต 2
ร่วมจิตประสาท,ต.บึงคอไห อ.ลำลูกกา จ.ปทุมธานี 12150,เขตพื้นที่การศึกษาปทุมธานี เขต 2
ร่วมใจประสิทธิ์,ต.บึงคอไห อ.ลำลูกกา จ.ปทุมธานี 12150,เขตพื้นที่การศึกษาปทุมธานี เขต 2
รวมราษฎร์สามัคคี,ต.บึงคอไห อ.ลำลูกกา จ.ปทุมธานี 12150,เขตพื้นที่การศึกษาปทุมธานี เขต 2
ราษฎร์นิรมิตร,ต.คุ้งลาน อ.บางปะอิน จ.พระนครศรีอยุธยา 13160,เขตพื้นที่การศึกษาพระนครศรีอยุธยา เขต 2
ราษฎร์บํารุง,ต.ตลิ่งชัน อ.บางปะอิน จ.พระนครศรีอยุธยา 13160,เขตพื้นที่การศึกษาพระนครศรีอยุธยา เขต 2
รอตเสวกวิทยา,ต.ภาชี อ.ภาชี จ.พระนครศรีอยุธยา 13140,เขตพื้นที่การศึกษาพระนครศรีอยุธยา เขต 1
รุ่งวิทยาประชาอุปถัมภ์,ต.พระยาบันลือ อ.ลาดบัวหลวง จ.พระนครศรีอยุธยา 13230,เขตพื้นที่การศึกษาพระนครศรีอยุธยา เขต 2
รอซีดี,ต.คลองพระยาบันลือ อ.ลาดบัวหลวง จ.พระนครศรีอยุธยา 13230,เขตพื้นที่การศึกษาพระนครศรีอยุธยา เขต 2
ราษฎร์บำรุงศิลป์,ต.เสนา อ.เสนา จ.พระนครศรีอยุธยา 13110,เขตพื้นที่การศึกษาพระนครศรีอยุธยา เขต 2
ราษฎร์ศุภประดิษฐ์,ต.ลาดงา อ.เสนา จ.พระนครศรีอยุธยา 13110,เขตพื้นที่การศึกษาพระนครศรีอยุธยา เขต 2
ราชสถิตย์วิทยา,ต.ราชสถิตย์ อ.ไชโย จ.อ่างทอง 14140,เขตพื้นที่การศึกษาอ่างทอง เขต 1
ริ้วหว้าวิทยาคม,ต.บ้านพราน อ.แสวงหา จ.อ่างทอง 14150,เขตพื้นที่การศึกษาอ่างทอง เขต 1
ราษฎร์นิยมวิทยา,ต.บางจัก อ.วิเศษชัยชาญ จ.อ่างทอง 14110,เขตพื้นที่การศึกษาอ่างทอง เขต 1
รุ่งนิวัติวิทยา,ต.เขาสมอคอน อ.ท่าวุ้ง จ.ลพบุรี 15180,เขตพื้นที่การศึกษาลพบุรี เขต 1
รัตนศึกษา,ต.บ้านหมี่ อ.บ้านหมี่ จ.ลพบุรี 15110,เขตพื้นที่การศึกษาลพบุรี เขต 1
รัฐเขื่อนพลเทพ อุปถัมภ์,ต.หาดท่าเสา อ.เมืองชัยนาท จ.ชัยนาท 17000,เขตพื้นที่การศึกษาชัยนาท เขต 1
ราษฎร์ศึกษา,ต.ปากเพรียว อ.เมืองสระบุรี จ.สระบุรี 18000,เขตพื้นที่การศึกษาสระบุรี เขต 1
รอดณรงค์ศึกษา,ต.มิตรภาพ อ.มวกเหล็ก จ.สระบุรี 18120,เขตพื้นที่การศึกษาสระบุรี เขต 2
ระพีวิทยา,ต.บางพระ อ.ศรีราชา จ.ชลบุรี 20210,เขตพื้นที่การศึกษาชลบุรี เขต 3
รัตนชัยศึกษา,ต.บางพระ อ.ศรีราชา จ.ชลบุรี 20210,เขตพื้นที่การศึกษาชลบุรี เขต 3
รังสิวัฒน์วิทยา,ต.ท่าเทววงษ์ อ.เกาะสีชัง จ.ชลบุรี 20120,เขตพื้นที่การศึกษาชลบุรี เขต 3
ราษฎร์ประดิษฐ์วิทยา,ต.นาจอมเทียน อ.สัตหีบ จ.ชลบุรี 20250,เขตพื้นที่การศึกษาชลบุรี เขต 3
ระยองวิทยาคม,ต.ท่าประดู่ อ.เมืองระยอง จ.ระยอง 21000,เขตพื้นที่การศึกษาระยอง เขต 1
ระยองวิทยาคมปากน้ำ,ต.ปากน้ำ อ.เมืองระยอง จ.ระยอง 21000,เขตพื้นที่การศึกษาระยอง เขต 1
ระยองวิทยาคม นิคมอุตสาหกรรม,ต.ห้วยโป่ง อ.เมืองระยอง จ.ระยอง,เขตพื้นที่การศึกษาระยอง เขต 1
รุ่งนภาพิทยา,ต.ทางเกวียน อ.แกลง จ.ระยอง 21110,เขตพื้นที่การศึกษาระยอง เขต 2
ราษฎร์พัฒนาสามัคคี,ต.หนองตาคง อ.โป่งน้ำร้อน จ.จันทบุรี 22140,เขตพื้นที่การศึกษาจันทบุรี เขต 2
รุ่งโรจน์วิทยา,ต.บางคล้า อ.บางคล้า จ.ฉะเชิงเทรา 24110,เขตพื้นที่การศึกษาฉะเชิงเทรา เขต 2
ราชสาส์นวิทยา,ต.บางคา อ.ราชสาส์น จ.ฉะเชิงเทรา 24120,เขตพื้นที่การศึกษาฉะเชิงเทรา เขต 2
ราษฎรนุกูล,ต.บางตลาด อ.คลองเขื่อน จ.ฉะเชิงเทรา 24110,เขตพื้นที่การศึกษาฉะเชิงเทรา เขต 2
รักษาทรัพย์พิทยากร,ต.กบินทร์ อ.กบินทร์บุรี จ.ปราจีนบุรี 25110,เขตพื้นที่การศึกษาปราจีนบุรี เขต 1
ร่มเกล้า ปราจีนบุรี,ต.บุพราหมณ์ อ.นาดี จ.ปราจีนบุรี 25220,เขตพื้นที่การศึกษาปราจีนบุรี เขต 1
ร่มเกล้า,ต.หนองตะเคียนบอน อ.วัฒนานคร จ.สระแก้ว 27160,เขตพื้นที่การศึกษาสระแก้ว เขต 2
ร่มเกล้าวัฒนานคร สระแก้ว รัชมัง,ต.หนองตะเคียนบอน อ.วัฒนานคร จ.สระแก้ว 27160,เขตพื้นที่การศึกษาสระแก้ว เขต 7
ราชสีมาวิทยาลัย,ต.ในเมือง อ.เมืองนครราชสีมา จ.นครราชสีมา 30000,เขตพื้นที่การศึกษานครราชสีมา เขต 1
รามมิตรวิทยา,ต.ในเมือง อ.เมืองนครราชสีมา จ.นครราชสีมา 30000,เขตพื้นที่การศึกษานครราชสีมา เขต 1
รัตโนภาส,ต.ในเมือง อ.เมืองนครราชสีมา จ.นครราชสีมา 30000,เขตพื้นที่การศึกษานครราชสีมา เขต 1
รัตโนภาสสุรนารี,ต.หนองจะบก อ.เมืองนครราชสีมา จ.นครราชสีมา 30000,เขตพื้นที่การศึกษานครราชสีมา เขต 1
ราชสีมาวิทยาลัย 2,ต.บ้านใหม่ อ.เมืองนครราชสีมา จ.นครราชสีมา 30000,เขตพื้นที่การศึกษานครราชสีมา เขต 1
รัฐการุณวิทยา,ต.ทองหลาง อ.จักราช จ.นครราชสีมา 30230,เขตพื้นที่การศึกษานครราชสีมา เขต 2
ราษฎร์บำรุง,ต.หนองขาม อ.จักราช จ.นครราชสีมา 30230,เขตพื้นที่การศึกษานครราชสีมา เขต 2
รวมมิตรพัฒนา,ต.โนนเพ็ด อ.ประทาย จ.นครราชสีมา 30180,เขตพื้นที่การศึกษานครราชสีมา เขต 7
รักเมืองไทย 1(มูลนิธิเตชะไพบูลย์),ต.บ่อปลาทอง อ.ปักธงชัย จ.นครราชสีมา 30150,เขตพื้นที่การศึกษานครราชสีมา เขต 3
ราษฎร์สโมสร,ต.กระชอน อ.พิมาย จ.นครราชสีมา 30110,เขตพื้นที่การศึกษานครราชสีมา เขต 7
รักชาติประชาบำรุง,ต.หลุ่งตะเคียน อ.ห้วยแถลง จ.นครราชสีมา 30240,เขตพื้นที่การศึกษานครราชสีมา เขต 2
ระดมวิทยานุสรณ์,ต.สูงเนิน อ.สูงเนิน จ.นครราชสีมา 30170,เขตพื้นที่การศึกษานครราชสีมา เขต 4
รัฐราษฎร์รังสรรค์,ต.ขามทะเลสอ อ.ขามทะเลสอ จ.นครราชสีมา 30280,เขตพื้นที่การศึกษานครราชสีมา เขต 5
รามวิทยาประชานุสรณ์,ต.ดอนเมือง อ.สีคิ้ว จ.นครราชสีมา 30140,เขตพื้นที่การศึกษานครราชสีมา เขต 4
รุ่งอรุณวิทยา,ต.ปากช่อง อ.ปากช่อง จ.นครราชสีมา 30130,เขตพื้นที่การศึกษานครราชสีมา เขต 4
ร่วมจิตต์วิทยา,ต.หนองแวง อ.ละหานทราย จ.บุรีรัมย์ 31170,เขตพื้นที่การศึกษาบุรีรัมย์ เขต 3
รวมมิตรวิทยา,ต.ผไทรินทร์ อ.ลำปลายมาศ จ.บุรีรัมย์ 31130,เขตพื้นที่การศึกษาบุรีรัมย์ เขต 1
ร่อนทองพิทยาคม,ต.ร่อนทอง อ.สตึก จ.บุรีรัมย์ 31150,เขตพื้นที่การศึกษาบุรีรัมย์ เขต 32
รุ่งนภาอนุสรณ์ศาสตร์,ต.โนนดินแดง อ.โนนดินแดง จ.บุรีรัมย์ 31260,เขตพื้นที่การศึกษาบุรีรัมย์ เขต 3
ร่มเกล้า บุรีรัมย์,ต.โนนดินแดง อ.โนนดินแดง จ.บุรีรัมย์ 31260,เขตพื้นที่การศึกษาบุรีรัมย์ เขต 32
รมย์บุรีพิทยาคม รัชมังคลาภิเษก,ต.บ้านด่าน อ.บ้านด่าน จ.บุรีรัมย์ 31000,เขตพื้นที่การศึกษาบุรีรัมย์ เขต 1
ราชวิถี(ประสาทราษฎร์บำรุง),ต.เฉนียง อ.เมืองสุรินทร์ จ.สุรินทร์ 32000,เขตพื้นที่การศึกษาสุรินทร์ เขต 1
รามวิทยา รัชมังคลาภิเษก,ต.ราม อ.เมืองสุรินทร์ จ.สุรินทร์ 32000,เขตพื้นที่การศึกษาสุรินทร์ เขต 33
รุ่งรัฐวิทยา,ต.ตระแสง อ.เมืองสุรินทร์ จ.สุรินทร์ 32000,เขตพื้นที่การศึกษาสุรินทร์ เขต 1
รัฐประชาสามัคคี,ต.เชื้อเพลิง อ.ปราสาท จ.สุรินทร์ 32140,เขตพื้นที่การศึกษาสุรินทร์ เขต 3
รัตนบุรี,ต.รัตนบุรี อ.รัตนบุรี จ.สุรินทร์ 32130,เขตพื้นที่การศึกษาสุรินทร์ เขต 2
รัตนวิทยาคม,ต.รัตนบุรี อ.รัตนบุรี จ.สุรินทร์ 32130,เขตพื้นที่การศึกษาสุรินทร์ เขต 2
ราษฎร์พัฒนา,ต.พระแก้ว อ.สังขะ จ.สุรินทร์ 32150,เขตพื้นที่การศึกษาสุรินทร์ เขต 3
รัฐราษฎร์พัฒนา,ต.ณรงค์ อ.ศรีณรงค์ จ.สุรินทร์ 32150,เขตพื้นที่การศึกษาสุรินทร์ เขต 3
รวมสินวิทยา,ต.เมืองใต้ อ.เมืองศรีสะเกษ จ.ศรีสะเกษ 33000,เขตพื้นที่การศึกษาศรีสะเกษ เขต 1
ร่มโพธิ์วิทยา,ต.ขุนหาญ อ.ขุนหาญ จ.ศรีสะเกษ 33150,เขตพื้นที่การศึกษาศรีสะเกษ เขต 4
ราษีไศล,ต.เมืองคง อ.ราษีไศล จ.ศรีสะเกษ 33160,เขตพื้นที่การศึกษาศรีสะเกษ เขต 2
รัชมังคลาภิเษกบ้านโนนป่าเลา,ต.ยาง อ.น้ำยืน จ.อุบลราชธานี 34260,เขตพื้นที่การศึกษาอุบลราชธานี เขต 5
ราษฎร์ร่วมแรงรัฐ(กำจัดอุปถัมภ์),ต.หนองเมือง อ.ม่วงสามสิบ จ.อุบลราชธานี 34140,เขตพื้นที่การศึกษาอุบลราชธานี เขต 1
ราษฎร์บำรุง,ต.ท่าใหญ่ อ.หนองบัวแดง จ.ชัยภูมิ 36210,เขตพื้นที่การศึกษาชัยภูมิ เขต 1
ร่วมราษฎร์วิทยานุกูล,ต.กะฮาด อ.เนินสง่า จ.ชัยภูมิ 36130,เขตพื้นที่การศึกษาชัยภูมิ เขต 3
รังงามวิทยา,ต.รังงาม อ.เนินสง่า จ.ชัยภูมิ 36130,เขตพื้นที่การศึกษาชัยภูมิ เขต 3
ร่มเกล้า,ต.โนนทัน อ.เมืองหนองบัวลำภู จ.หนองบัวลำภู 39000,เขตพื้นที่การศึกษาหนองบัวลำภู เขต 1
ราษฎร์อุทิศศึกษา,ต.ในเมือง อ.เมืองขอนแก่น จ.ขอนแก่น 40000,เขตพื้นที่การศึกษาขอนแก่น เขต 1
ร่มเย็นประชาสรรค์,ต.โนนพะยอม อ.ชนบท จ.ขอนแก่น 40180,เขตพื้นที่การศึกษาขอนแก่น เขต 2
