รังสรรค์วิทยาคม,ต.โนนศิลา อ.โนนศิลา จ.ขอนแก่น 40110,เขตพื้นที่การศึกษาขอนแก่น เขต 3
ราชินูทิศ 2,ต.บ้านจั่น อ.เมืองอุดรธานี จ.อุดรธานี 41000,เขตพื้นที่การศึกษาอุดรธานี เขต 20
รัฐประชา 509,ต.โนนหวาย อ.หนองวัวซอ จ.อุดรธานี 41220,เขตพื้นที่การศึกษาอุดรธานี เขต 1
ร่มเกล้า 2 อุดรธานี,ต.ไชยวาน อ.ไชยวาน จ.อุดรธานี 41290,เขตพื้นที่การศึกษาอุดรธานี เขต 3
ราษฎร์จุฬาสามัคคี,ต.คำบง อ.บ้านผือ จ.อุดรธานี 41160,เขตพื้นที่การศึกษาอุดรธานี เขต 4
ร่มเกล้าบ้านชมเจริญ,ต.ชมเจริญ อ.ปากชม จ.เลย 42150,เขตพื้นที่การศึกษาเลย เขต 1
ราชตั้งใจวิทยา,ต.ในเมือง อ.เมืองหนองคาย จ.หนองคาย 43000,เขตพื้นที่การศึกษาหนองคาย เขต 1
ราชประชานุเคราะห์ 14,ต.ค่ายบกหวาน อ.เมืองหนองคาย จ.หนองคาย 43100,เขตพื้นที่การศึกษาหนองคาย เขต 1
ราษฎร์นุเคราะห์,ต.พระธาตุบังพวน อ.เมืองหนองคาย จ.หนองคาย 43100,เขตพื้นที่การศึกษาหนองคาย เขต 1
ร่วมมิตรวิทยา,ต.นาข่า อ.ท่าบ่อ จ.หนองคาย,เขตพื้นที่การศึกษาหนองคาย เขต 1
ราษฎร์สามัคคี,ต.หนองนาง อ.ท่าบ่อ จ.หนองคาย 43110,เขตพื้นที่การศึกษาหนองคาย เขต 1
ร่มธรรมานุสรณ์,ต.เหล่าต่างคำ อ.โพนพิสัย จ.หนองคาย 43120,เขตพื้นที่การศึกษาหนองคาย เขต 2
รสลินคัคณางค์,ต.เฝ้าไร่ อ.เฝ้าไร่ จ.หนองคาย 43120,เขตพื้นที่การศึกษาหนองคาย เขต 2
รุจีจินตกานนท์,ต.นาทับไฮ อ.รัตนวาปี จ.หนองคาย 43120,เขตพื้นที่การศึกษาหนองคาย เขต 2
ราชประชานุเคราะห์ 17,ต.หนองแสง อ.วาปีปทุม จ.มหาสารคาม 44120,เขตพื้นที่การศึกษามหาสารคาม เขต 2
รุ่งอรุณวิทย์,ต.หนองแสง อ.วาปีปทุม จ.มหาสารคาม 44120,เขตพื้นที่การศึกษามหาสารคาม เขต 2
ราชประชานุเคราะห์ 18,ต.โพธิ์ชัย อ.วาปีปทุม จ.มหาสารคาม 44120,เขตพื้นที่การศึกษามหาสารคาม เขต 2
ราชประชานุเคราะห์ 16,ต.หัวเรือ อ.วาปีปทุม จ.มหาสารคาม 44120,เขตพื้นที่การศึกษามหาสารคาม เขต 2
ร้อยเอ็ดวิทยาลัย,ต.ในเมือง อ.เมืองร้อยเอ็ด จ.ร้อยเอ็ด 45000,เขตพื้นที่การศึกษาร้อยเอ็ด เขต 1
ร้อยเอ็ดการบริบาล,ต.ในเมือง อ.เมืองร้อยเอ็ด จ.ร้อยเอ็ด 45000,เขตพื้นที่การศึกษาร้อยเอ็ด เขต 1
รัฐทวิคาม,ต.น้ำใส อ.จตุรพักตรพิมาน จ.ร้อยเอ็ด 45180,เขตพื้นที่การศึกษาร้อยเอ็ด เขต 1
รัฐประชาวิทยาคาร,ต.ดงกลาง อ.จตุรพักตรพิมาน จ.ร้อยเอ็ด 45180,เขตพื้นที่การศึกษาร้อยเอ็ด เขต 1
ราชสารสุธีอนุสรณ์,ต.อีง่อง อ.จตุรพักตรพิมาน จ.ร้อยเอ็ด 45180,เขตพื้นที่การศึกษาร้อยเอ็ด เขต 1
รัตนประชานุสรณ์,ต.ลิ้นฟ้า อ.จตุรพักตรพิมาน จ.ร้อยเอ็ด 45180,เขตพื้นที่การศึกษาร้อยเอ็ด เขต 1
รุ่งรัศมีเดชาวิทย์,ต.กุงเก่า อ.ท่าคันโท จ.กาฬสินธุ์ 46190,เขตพื้นที่การศึกษากาฬสินธุ์ เขต 2
รัชมังคลาภิเษก(บ้านนายอ),ต.โนนนาจาน อ.นาคู จ.กาฬสินธุ์ 46160,เขตพื้นที่การศึกษากาฬสินธุ์ เขต 3
ร่มเกล้า,ต.ตองโขบ อ.โคกศรีสุพรรณ จ.สกลนคร 47280,เขตพื้นที่การศึกษาสกลนคร เขต 23
รอดโพธิ์ทองวิทยาสรรค์,ต.กุรุคุ อ.เมืองนครพนม จ.นครพนม 48000,เขตพื้นที่การศึกษานครพนม เขต 1
รามราชพิทยาคม,ต.รามราช อ.ท่าอุเทน จ.นครพนม 48120,เขตพื้นที่การศึกษานครพนม เขต 2
ราษฎร์สามัคคี,ต.ท่าเรือ อ.นาหว้า จ.นครพนม 48180,เขตพื้นที่การศึกษานครพนม เขต 2
ร่มเกล้าพิทยาสรรค์,ต.ร่มเกล้า อ.นิคมคำสร้อย จ.มุกดาหาร 49130,เขตพื้นที่การศึกษามุกดาหาร เขต 1
ร่มเกล้า,ต.หนองแคน อ.ดงหลวง จ.มุกดาหาร 49000,เขตพื้นที่การศึกษามุกดาหาร เขต 1
ร่ำเปิงวิทยา,ต.ขี้เหล็ก อ.แม่แตง จ.เชียงใหม่ 50150,เขตพื้นที่การศึกษาเชียงใหม่ เขต 2
รังษีวิทยา,ต.เวียง อ.ฝาง จ.เชียงใหม่ 50110,เขตพื้นที่การศึกษาเชียงใหม่ เขต 3
รัตนาเอื้อวิทยา,ต.แม่สูน อ.ฝาง จ.เชียงใหม่ 50110,เขตพื้นที่การศึกษาเชียงใหม่ เขต 3
รัฐราษฎร์อุปถัมภ์,ต.เปียงหลวง อ.เวียงแหง จ.เชียงใหม่ 50350,เขตพื้นที่การศึกษาเชียงใหม่ เขต 3
ราชวิมานหลวง,ต.ในเมือง อ.เมืองลำพูน จ.ลำพูน 51000,เขตพื้นที่การศึกษาลำพูน เขต 1
รพีเลิศวิทยา,ต.ป่าสัก อ.เมืองลำพูน จ.ลำพูน 51000,เขตพื้นที่การศึกษาลำพูน เขต 1
ร่องเคาะวิทยา,ต.ร่องเคาะ อ.วังเหนือ จ.ลำปาง 52140,เขตพื้นที่การศึกษาลำปาง เขต 3
ราษฎร์ดําริ,ต.บ้านด่านนาขาม อ.เมืองอุตรดิตถ์ จ.อุตรดิตถ์ 53000,เขตพื้นที่การศึกษาอุตรดิตถ์ เขต 1
ราษฎร์อํานวย,ต.บ้านด่านนาขาม อ.เมืองอุตรดิตถ์ จ.อุตรดิตถ์ 53000,เขตพื้นที่การศึกษาอุตรดิตถ์ เขต 1
ราษฎร์อุปถัมภ์,ต.บ้านด่านนาขาม อ.เมืองอุตรดิตถ์ จ.อุตรดิตถ์ 53000,เขตพื้นที่การศึกษาอุตรดิตถ์ เขต 1
ราษฎร์อุปถัมภ์ สาขาหนองน้ำเขียว,ต.บ้านด่านนาขาม อ.เมืองอุตรดิตถ์ จ.อุตรดิตถ์ 53000,เขตพื้นที่การศึกษาอุตรดิตถ์ เขต 1
ร้องประดู่(หนุนเภา-ประชาสงเคราะห์),ต.บ้านแก่ง อ.ตรอน จ.อุตรดิตถ์ 53140,เขตพื้นที่การศึกษาอุตรดิตถ์ เขต 1
ราชประชานุเคราะห์ 13,ต.ท่าแฝก อ.ท่าปลา จ.อุตรดิตถ์ 53110,เขตพื้นที่การศึกษาอุตรดิตถ์ เขต 2
รัฐราษฎร์บำรุง,ต.ทุ่งกวาว อ.เมืองแพร่ จ.แพร่ 54000,เขตพื้นที่การศึกษาแพร่ เขต 1
ร้องกวางอนุสรณ์,ต.ร้องเข็ม อ.ร้องกวาง จ.แพร่ 54140,เขตพื้นที่การศึกษาแพร่ เขต 1
รักเมืองไทย 2,ต.ห้วยอ้อ อ.ลอง จ.แพร่ 54150,เขตพื้นที่การศึกษาแพร่ เขต 2
ราชานุบาล,ต.ในเวียง อ.เมืองน่าน จ.น่าน 55000,เขตพื้นที่การศึกษาน่าน เขต 1
รัฐราษฎร์นุเคราะห์,ต.สวด อ.บ้านหลวง จ.น่าน 55190,เขตพื้นที่การศึกษาน่าน เขต 1
ริม-ป่าคาประชานุเคราะห์,ต.ท่าวังผา อ.ท่าวังผา จ.น่าน 55140,เขตพื้นที่การศึกษาน่าน เขต 2
ริมฝั่งว้าวิทยา,ต.ไหล่น่าน อ.เวียงสา จ.น่าน 55110,เขตพื้นที่การศึกษาน่าน เขต 1
ริมฝั่งน่านวิทยา,ต.นาเหลือง อ.เวียงสา จ.น่าน 55110,เขตพื้นที่การศึกษาน่าน เขต 1
ราษฎร์รัฐพัฒนา,ต.พงษ์ อ.สันติสุข จ.น่าน 55210,เขตพื้นที่การศึกษาน่าน เขต 1
ราชานุเคราะห์,ต.ผาช้างน้อย อ.ปง จ.พะเยา 56140,เขตพื้นที่การศึกษาพะเยา เขต 2
ร่องเบ้อวิทยา,ต.ห้วยสัก อ.เมืองเชียงราย จ.เชียงราย 57000,เขตพื้นที่การศึกษาเชียงราย เขต 1
ริมโขงวิทยา,ต.ริมโขง อ.เชียงของ จ.เชียงราย 57140,เขตพื้นที่การศึกษาเชียงราย เขต 4
ริมวัง ๑,ต.ป่าหุ่ง อ.พาน จ.เชียงราย 57120,เขตพื้นที่การศึกษาเชียงราย เขต 2
ริมวัง ๒,ต.ป่าหุ่ง อ.พาน จ.เชียงราย 57120,เขตพื้นที่การศึกษาเชียงราย เขต 2
ร่องธารวิทยา,ต.ทรายขาว อ.พาน จ.เชียงราย 57250,เขตพื้นที่การศึกษาเชียงราย เขต 2
ราชประชานุเคราะห์15(เวียงเก่าแสนภูวิทยาประสาท),ต.เวียง อ.เชียงแสน จ.เชียงราย 57150,เขตพื้นที่การศึกษาเชียงราย เขต 3
รัฐราษฎร์วิทยา,ต.แม่สลองใน อ.แม่ฟ้าหลวง จ.เชียงราย 57240,เขตพื้นที่การศึกษาเชียงราย เขต 3
ราษฎร์พัฒนา,ต.แม่สลองนอก อ.แม่ฟ้าหลวง จ.เชียงราย 57110,เขตพื้นที่การศึกษาเชียงราย เขต 3
ร่มเกล้าปางตอง,ต.หมอกจำแป่ อ.เมืองแม่ฮ่องสอน จ.แม่ฮ่องสอน 58000,เขตพื้นที่การศึกษาแม่ฮ่องสอน เขต 1
รักษ์ไพรวิทยา,ต.เมืองปอน อ.ขุนยวม จ.แม่ฮ่องสอน 58140,เขตพื้นที่การศึกษาแม่ฮ่องสอน เขต 1
รัตนประทีปวิทยา,ต.ป่าแป๋ อ.แม่สะเรียง จ.แม่ฮ่องสอน 58110,เขตพื้นที่การศึกษาแม่ฮ่องสอน เขต 2
ราษฎร์อุทิศ,ต.บางประมุง อ.โกรกพระ จ.นครสวรรค์ 60170,เขตพื้นที่การศึกษานครสวรรค์ เขต 1
รัฐราษฎร์อนุสรณ์,ต.บึงปลาทู อ.บรรพตพิสัย จ.นครสวรรค์ 60180,เขตพื้นที่การศึกษานครสวรรค์ เขต 2
ราษฎร์ร่วมสามัคคี,ต.บึงปลาทู อ.บรรพตพิสัย จ.นครสวรรค์ 60180,เขตพื้นที่การศึกษานครสวรรค์ เขต 2
รวมมิตรวิทยา(คังคะเกตุอุปถัมภ์),ต.หัวหวาย อ.ตาคลี จ.นครสวรรค์ 60140,เขตพื้นที่การศึกษานครสวรรค์ เขต 3
รังสรรค์วิทยา,ต.ตากฟ้า อ.ตากฟ้า จ.นครสวรรค์ 60190,เขตพื้นที่การศึกษานครสวรรค์ เขต 3
ร่องตาทีวิทยา,ต.ลานสัก อ.ลานสัก จ.อุทัยธานี 61160,เขตพื้นที่การศึกษาอุทัยธานี เขต 1
รัตนโกสินทร์2(สมโภชกรุงรัตนโกสินทร์),ต.ป่าอ้อ อ.ลานสัก จ.อุทัยธานี 61160,เขตพื้นที่การศึกษาอุทัยธานี เขต 1
รอดนิลวิทยา,ต.คลองน้ำไหล อ.คลองลาน จ.กำแพงเพชร 62180,เขตพื้นที่การศึกษากำแพงเพชร เขต 2
รังษีวิทยา,ต.สลกบาตร อ.ขาณุวรลักษบุรี จ.กำแพงเพชร 62140,เขตพื้นที่การศึกษากำแพงเพชร เขต 2
ราษฎร์ปรีชาวิทยาคม,ต.จันทิมา อ.ลานกระบือ จ.กำแพงเพชร 62170,เขตพื้นที่การศึกษากำแพงเพชร เขต 41
ระหานวิทยา,ต.ระหาน อ.บึงสามัคคี จ.กำแพงเพชร 62210,เขตพื้นที่การศึกษากำแพงเพชร เขต 2
ราษฎร์วิทยา,ต.แม่สอด อ.แม่สอด จ.ตาก 63110,เขตพื้นที่การศึกษาตาก เขต 2
รวมไทยพัฒนา 6,ต.ช่องแคบ อ.พบพระ จ.ตาก 63160,เขตพื้นที่การศึกษาตาก เขต 2
รวมไทยพัฒนา 3,ต.คีรีราษฎร์ อ.พบพระ จ.ตาก 63160,เขตพื้นที่การศึกษาตาก เขต 2
รวมไทยพัฒนา 5,ต.วาเล่ย์ อ.พบพระ จ.ตาก 63160,เขตพื้นที่การศึกษาตาก เขต 2
รวมไทยพัฒนา 1,ต.รวมไทยพัฒนา อ.พบพระ จ.ตาก 63160,เขตพื้นที่การศึกษาตาก เขต 2
รวมไทยพัฒนา 2,ต.รวมไทยพัฒนา อ.พบพระ จ.ตาก 63160,เขตพื้นที่การศึกษาตาก เขต 2
รวมไทยพัฒนา 4,ต.รวมไทยพัฒนา อ.พบพระ จ.ตาก 63160,เขตพื้นที่การศึกษาตาก เขต 2
รัฐราษฎร์สงเคราะห์,ต.นิคมพัฒนา อ.บางระกำ จ.พิษณุโลก 65140,เขตพื้นที่การศึกษาพิษณุโลก เขต 1
ราษฎร์เจริญ,ต.โคกสลุด อ.บางกระทุ่ม จ.พิษณุโลก 65110,เขตพื้นที่การศึกษาพิษณุโลก เขต 2
ราษฎร์ดำริ,ต.โคกสลุด อ.บางกระทุ่ม จ.พิษณุโลก 65110,เขตพื้นที่การศึกษาพิษณุโลก เขต 2
รัฐราษฎร์บำรุง,ต.วัดตายม อ.บางกระทุ่ม จ.พิษณุโลก 65210,เขตพื้นที่การศึกษาพิษณุโลก เขต 2
ราษฎร์บำรุง,ต.ท่าช้าง อ.พรหมพิราม จ.พิษณุโลก 65150,เขตพื้นที่การศึกษาพิษณุโลก เขต 3
ราษฎร์สามัคคี,ต.ท่าช้าง อ.พรหมพิราม จ.พิษณุโลก 65150,เขตพื้นที่การศึกษาพิษณุโลก เขต 3
ราษฎร์ศรัทธาวิทยา,ต.วงฆ้อง อ.พรหมพิราม จ.พิษณุโลก 65180,เขตพื้นที่การศึกษาพิษณุโลก เขต 3
ราษฎร์อุปถัมภ์,ต.ชัยนาม อ.วังทอง จ.พิษณุโลก 65130,เขตพื้นที่การศึกษาพิษณุโลก เขต 2
รักไทยร่มเกล้าอุปถัมภ์,ต.ชมพู อ.เนินมะปราง จ.พิษณุโลก 65190,เขตพื้นที่การศึกษาพิษณุโลก เขต 2
ราษฎร์บำรุง,ต.ในเมือง อ.เมืองพิจิตร จ.พิจิตร 66000,เขตพื้นที่การศึกษาพิจิตร เขต 1
ราษฎร์เจริญ,ต.หัวดง อ.เมืองพิจิตร จ.พิจิตร 66170,เขตพื้นที่การศึกษาพิจิตร เขต 1
ราษฎร์วิทยา,ต.ทุ่งโพธิ์ อ.ตะพานหิน จ.พิจิตร 66150,เขตพื้นที่การศึกษาพิจิตร เขต 2
รัฐประชานุสรณ์,ต.ซับน้อย อ.วิเชียรบุรี จ.เพชรบูรณ์ 67180,เขตพื้นที่การศึกษาเพชรบูรณ์ เขต 3
ร่มเกล้าเขาค้อ เพชรบูรณ์,ต.เขาค้อ อ.เขาค้อ จ.เพชรบูรณ์ 67270,เขตพื้นที่การศึกษาเพชรบูรณ์ เขต 2
ราชโบริกานุเคราะห์,ต.หน้าเมือง อ.เมืองราชบุรี จ.ราชบุรี 70000,เขตพื้นที่การศึกษาราชบุรี เขต 1
รัฐราษฏร์อุปถัมภ์,ต.อ่างทอง อ.เมืองราชบุรี จ.ราชบุรี 70000,เขตพื้นที่การศึกษาราชบุรี เขต 1
รุจิรพัฒน์,ต.ตะนาวศรี อ.สวนผึ้ง จ.ราชบุรี 70180,เขตพื้นที่การศึกษาราชบุรี เขต 1
รัตนราษฏร์บำรุง,ต.บ้านโป่ง อ.บ้านโป่ง จ.ราชบุรี 70110,เขตพื้นที่การศึกษาราชบุรี เขต 2
ราษฎร์บำรุงวิทย์,ต.โพธาราม อ.โพธาราม จ.ราชบุรี 70120,เขตพื้นที่การศึกษาราชบุรี เขต 2
ราษฎร์บำรุง,ต.ท่าเรือ อ.ท่ามะกา จ.กาญจนบุรี 71130,เขตพื้นที่การศึกษากาญจนบุรี เขต 2
ร่มเกล้า กาญจนบุรี,ต.ลิ่นถิ่น อ.ทองผาภูมิ จ.กาญจนบุรี 71180,เขตพื้นที่การศึกษากาญจนบุรี เขต 3
ราษฎร์บํารุงธรรม,ต.ทุ่งกระบ่ำ อ.เลาขวัญ จ.กาญจนบุรี,เขตพื้นที่การศึกษากาญจนบุรี เขต 2
รัตนศึกษา,ต.อู่ทอง อ.อู่ทอง จ.สุพรรณบุรี 72160,เขตพื้นที่การศึกษาสุพรรณบุรี เขต 2
รัตนไพศาล,ต.จรเข้สามพัน อ.อู่ทอง จ.สุพรรณบุรี 72160,เขตพื้นที่การศึกษาสุพรรณบุรี เขต 2
ราชินีบูรณะ,ต.พระปฐมเจดีย์ อ.เมืองนครปฐม จ.นครปฐม 73000,เขตพื้นที่การศึกษานครปฐม เขต 1
ราษฎร์บำรุงวิทยา,ต.สามง่าม อ.ดอนตูม จ.นครปฐม 73150,เขตพื้นที่การศึกษานครปฐม เขต 1
รัตนโกสินทร์สมโภชบวรนิเวศศาลายา,ต.ศาลายา อ.พุทธมณฑล จ.นครปฐม 73170,เขตพื้นที่การศึกษานครปฐม เขต 2
ราษฎร์วิทยา,อ.เมืองเพชรบุรี จ.เพชรบุรี 76000,เขตพื้นที่การศึกษาเพชรบุรี เขต 1
รัชตวิทยาคม,ต.เขาน้อย อ.ปราณบุรี จ.ประจวบคีรีขันธ์ 77120,เขตพื้นที่การศึกษาประจวบคีรีขันธ์ เขต 2
รักษ์วิทยา,ต.วังก์พง อ.ปราณบุรี จ.ประจวบคีรีขันธ์ 77120,เขตพื้นที่การศึกษาประจวบคีรีขันธ์ เขต 2
