ตำหรุ มิตรภาพที่ 65,ต.บางปูใหม่ อ.เมืองสมุทรปราการ จ.สมุทรปราการ 10280,เขตพื้นที่การศึกษาสมุทรปราการ เขต 1
ตำหนักใต้(วิลาศโอสถานนท์นุเคราะห์),ต.ท่าทราย อ.เมืองนนทบุรี จ.นนทบุรี 11000,เขตพื้นที่การศึกษานนทบุรี เขต 1
ตึก(จำลองศิลป์วิทยา),ต.บางไผ่ อ.เมืองนนทบุรี จ.นนทบุรี 11000,เขตพื้นที่การศึกษานนทบุรี เขต 1
ตาล,ต.บางตะไนย์ อ.ปากเกร็ด จ.นนทบุรี 11120,เขตพื้นที่การศึกษานนทบุรี เขต 2
ตำหนักเหนือ(ชื่นวิทยานุสรณ์),ต.บางตะไนย์ อ.ปากเกร็ด จ.นนทบุรี 11120,เขตพื้นที่การศึกษานนทบุรี เขต 2
ตะวันเรือง,ต.คลองสี่ อ.คลองหลวง จ.ปทุมธานี 12120,เขตพื้นที่การศึกษาปทุมธานี เขต 1
ตูม,ต.วัดตูม อ.พระนครศรีอยุธยา จ.พระนครศรีอยุธยา 13000,เขตพื้นที่การศึกษาพระนครศรีอยุธยา เขต 1
ตะโหนด(ประชารักษ์เวสสถิตวิทยา),ต.นครหลวง อ.นครหลวง จ.พระนครศรีอยุธยา 13260,เขตพื้นที่การศึกษาพระนครศรีอยุธยา เขต 1
ตะกู (เมตตาชนูปการ),ต.วัดตะกู อ.บางบาล จ.พระนครศรีอยุธยา 13250,เขตพื้นที่การศึกษาพระนครศรีอยุธยา เขต 2
ตลาด (อุดมวิทยา),ต.ตลาดเกรียบ อ.บางปะอิน จ.พระนครศรีอยุธยา 13160,เขตพื้นที่การศึกษาพระนครศรีอยุธยา เขต 2
ตลาด,ต.หันสัง อ.บางปะหัน จ.พระนครศรีอยุธยา 13220,เขตพื้นที่การศึกษาพระนครศรีอยุธยา เขต 1
ตาลเอน (โศถนชนูปถัมภ์),ต.ตาลเอน อ.บางปะหัน จ.พระนครศรีอยุธยา 13220,เขตพื้นที่การศึกษาพระนครศรีอยุธยา เขต 1
ตาลานเหนือ,ต.ตาลาน อ.ผักไห่ จ.พระนครศรีอยุธยา 13120,เขตพื้นที่การศึกษาพระนครศรีอยุธยา เขต 2
ตาลานใต้ (เจริญวิทยา),ต.บ้านใหญ่ อ.ผักไห่ จ.พระนครศรีอยุธยา 13120,เขตพื้นที่การศึกษาพระนครศรีอยุธยา เขต 2
ตรีพาราสีมาเขต,ต.สามเมือง อ.ลาดบัวหลวง จ.พระนครศรีอยุธยา 13230,เขตพื้นที่การศึกษาพระนครศรีอยุธยา เขต 2
ตะบอง (ธรรมาภิรมอุปถัมภ์),ต.กะทุ่ม อ.มหาราช จ.พระนครศรีอยุธยา 13220,เขตพื้นที่การศึกษาพระนครศรีอยุธยา เขต 1
ตาลเจ็ดช่อ,ต.ตลาดกรวด อ.เมืองอ่างทอง จ.อ่างทอง 14000,เขตพื้นที่การศึกษาอ่างทอง เขต 1
ต้นทอง,ต.ไผ่วง อ.วิเศษชัยชาญ จ.อ่างทอง 14110,เขตพื้นที่การศึกษาอ่างทอง เขต 1
ตลาดใหม่,ต.ตลาดใหม่ อ.วิเศษชัยชาญ จ.อ่างทอง 14110,เขตพื้นที่การศึกษาอ่างทอง เขต 1
ตองปุ,ต.ทะเลชุบศร อ.เมืองลพบุรี จ.ลพบุรี 15000,เขตพื้นที่การศึกษาลพบุรี เขต 1
ตะลุง,ต.ตะลุง อ.เมืองลพบุรี จ.ลพบุรี 15000,เขตพื้นที่การศึกษาลพบุรี เขต 1
ตะเคียน,ต.ท้ายตลาด อ.เมืองลพบุรี จ.ลพบุรี 15000,เขตพื้นที่การศึกษาลพบุรี เขต 1
ตึกราชา,ต.ม่วงหมู่ อ.เมืองสิงห์บุรี จ.สิงห์บุรี 16000,เขตพื้นที่การศึกษาสิงห์บุรี เขต 1
ตะโหนด,ต.หัวไผ่ อ.เมืองสิงห์บุรี จ.สิงห์บุรี 16000,เขตพื้นที่การศึกษาสิงห์บุรี เขต 1
ตลาดโพธิ์,ต.ไม้ดัด อ.บางระจัน จ.สิงห์บุรี 16130,เขตพื้นที่การศึกษาสิงห์บุรี เขต 1
ตะโกรวม,ต.คอทราย อ.ค่ายบางระจัน จ.สิงห์บุรี 16150,เขตพื้นที่การศึกษาสิงห์บุรี เขต 1
ตุ้มหู,ต.ท่างาม อ.อินทร์บุรี จ.สิงห์บุรี 16110,เขตพื้นที่การศึกษาสิงห์บุรี เขต 1
ตะกู(สมจิตรัชนีอุปถัมภ์),ต.โพนางดำตก อ.สรรพยา จ.ชัยนาท 17150,เขตพื้นที่การศึกษาชัยนาท เขต 1
ตาลเดี่ยว,ต.ตาลเดี่ยว อ.แก่งคอย จ.สระบุรี 18110,เขตพื้นที่การศึกษาสระบุรี เขต 2
ตรีบุญญาราม,ต.ธารเกษม อ.พระพุทธบาท จ.สระบุรี 18120,เขตพื้นที่การศึกษาสระบุรี เขต 1
ตาลเสี้ยน(สีมาราษฎร์),ต.หนองแก อ.พระพุทธบาท จ.สระบุรี 18120,เขตพื้นที่การศึกษาสระบุรี เขต 1
ต้นตาล(ต้นตาลประชาสฤษฎิ์),ต.ต้นตาล อ.เสาไห้ จ.สระบุรี 18160,เขตพื้นที่การศึกษาสระบุรี เขต 1
ตะเฆ่(ม่วงงามนุเคราะห์),ต.ม่วงงาม อ.เสาไห้ จ.สระบุรี 18160,เขตพื้นที่การศึกษาสระบุรี เขต 1
ตาลล้อม,ต.เหมือง อ.เมืองชลบุรี จ.ชลบุรี 20130,เขตพื้นที่การศึกษาชลบุรี เขต 1
ตโปทาราม,ต.บางพระ อ.ศรีราชา จ.ชลบุรี 20110,เขตพื้นที่การศึกษาชลบุรี เขต 3
ตะพงนอก,ต.ตะพง อ.เมืองระยอง จ.ระยอง 21000,เขตพื้นที่การศึกษาระยอง เขต 1
ตะเคียนทอง,ต.แกลง อ.เมืองระยอง จ.ระยอง 21160,เขตพื้นที่การศึกษาระยอง เขต 1
ตากวน,ต.มาบตาพุด อ.เมืองระยอง จ.ระยอง 21150,เขตพื้นที่การศึกษาระยอง เขต 1
ตาขัน,ต.ตาขัน อ.บ้านค่าย จ.ระยอง 21120,เขตพื้นที่การศึกษาระยอง เขต 1
ตะปอนน้อย,ต.ตะปอน อ.ขลุง จ.จันทบุรี 22110,เขตพื้นที่การศึกษาจันทบุรี เขต 2
ตะปอนใหญ่(เศวตวิทยาคาร),ต.ตะปอน อ.ขลุง จ.จันทบุรี 22110,เขตพื้นที่การศึกษาจันทบุรี เขต 2
ตกพรม,ต.ตกพรม อ.ขลุง จ.จันทบุรี 22110,เขตพื้นที่การศึกษาจันทบุรี เขต 2
ตะกาดเง้า,ต.ตะกาดเง้า อ.ท่าใหม่ จ.จันทบุรี 22120,เขตพื้นที่การศึกษาจันทบุรี เขต 1
ตะเคียนทอง,ต.ตะเคียนทอง อ.เขาคิชฌกูฏ จ.จันทบุรี 22210,เขตพื้นที่การศึกษาจันทบุรี เขต 2
ตะกาง,ต.ตะกาง อ.เมืองตราด จ.ตราด 23000,เขตพื้นที่การศึกษาตราด เขต 1
ตาพลาย,ต.สะตอ อ.เขาสมิง จ.ตราด 23150,เขตพื้นที่การศึกษาตราด เขต 1
ตะพังคลี,ต.โพรงอากาศ อ.บางน้ำเปรี้ยว จ.ฉะเชิงเทรา 24150,เขตพื้นที่การศึกษาฉะเชิงเทรา เขต 1
ต้นตาล,ต.หนองยาว อ.พนมสารคาม จ.ฉะเชิงเทรา 24120,เขตพื้นที่การศึกษาฉะเชิงเทรา เขต 2
ตันทาราม,ต.นนทรี อ.กบินทร์บุรี จ.ปราจีนบุรี 25110,เขตพื้นที่การศึกษาปราจีนบุรี เขต 1
ตะเคียนทอง,ต.คำโตนด อ.ประจันตคาม จ.ปราจีนบุรี 25130,เขตพื้นที่การศึกษาปราจีนบุรี เขต 1
ต้นโพธิ์ศรีมหาโพธิ,ต.โคกไทย อ.ศรีมโหสถ จ.ปราจีนบุรี 25190,เขตพื้นที่การศึกษาปราจีนบุรี เขต 1
ตำหนัก(ละเอียดชำนาญอนุศาสน์),ต.สาริกา อ.เมืองนครนายก จ.นครนายก 26000,เขตพื้นที่การศึกษานครนายก เขต 1
ตะลุงเก่า,ต.โคกม้า อ.ประโคนชัย จ.บุรีรัมย์ 31140,เขตพื้นที่การศึกษาบุรีรัมย์ เขต 2
ตำหนัก,ต.ดอนแก้ว อ.สารภี จ.เชียงใหม่ 50140,เขตพื้นที่การศึกษาเชียงใหม่ เขต 4
ต้นโชค(บ้านฝายแป้น),ต.เหมืองจี้ อ.เมืองลำพูน จ.ลำพูน 51000,เขตพื้นที่การศึกษาลำพูน เขต 1
ต้นต้อง,ต.พิชัย อ.เมืองลำปาง จ.ลำปาง 52000,เขตพื้นที่การศึกษาลำปาง เขต 1
ต้นไคร้,ต.ช่อแฮ อ.เมืองแพร่ จ.แพร่ 54000,เขตพื้นที่การศึกษาแพร่ เขต 1
ตอนิมิตร(สิทธิราษฎร์รังสรรค์),ต.ร่องกาศ อ.สูงเม่น จ.แพร่ 54130,เขตพื้นที่การศึกษาแพร่ เขต 2
ตะเคียนเลื่อน(รังสีวุฒากาสอุปถัมภ์),ต.ตะเคียนเลื่อน อ.เมืองนครสวรรค์ จ.นครสวรรค์ 60000,เขตพื้นที่การศึกษานครสวรรค์ เขต 1
ตาสังใต้,ต.ตาสัง อ.บรรพตพิสัย จ.นครสวรรค์ 60180,เขตพื้นที่การศึกษานครสวรรค์ เขต 2
ตาคลี(นิปุณทองคำประชาสรรค์),ต.ตาคลี อ.ตาคลี จ.นครสวรรค์ 60140,เขตพื้นที่การศึกษานครสวรรค์ เขต 3
ตานาด,ต.เนินแจง อ.เมืองอุทัยธานี จ.อุทัยธานี 61000,เขตพื้นที่การศึกษาอุทัยธานี เขต 1
ตลุกหมู (วรพจน์ชนูปถัมภ์),ต.หนองกลางดง อ.ทัพทัน จ.อุทัยธานี 61120,เขตพื้นที่การศึกษาอุทัยธานี เขต 1
ตลุกดู่,ต.ตลุกดู่ อ.ทัพทัน จ.อุทัยธานี 61120,เขตพื้นที่การศึกษาอุทัยธานี เขต 1
ตาลเตี้ย,ต.ตาลเตี้ย อ.เมืองสุโขทัย จ.สุโขทัย 64220,เขตพื้นที่การศึกษาสุโขทัย เขต 1
ตลิ่งชัน,ต.ศรีสัชนาลัย อ.ศรีสัชนาลัย จ.สุโขทัย 64190,เขตพื้นที่การศึกษาสุโขทัย เขต 2
ตาปะขาวหาย,ต.หัวรอ อ.เมืองพิษณุโลก จ.พิษณุโลก 65000,เขตพื้นที่การศึกษาพิษณุโลก เขต 1
ตายม,ต.วัดตายม อ.บางกระทุ่ม จ.พิษณุโลก 65210,เขตพื้นที่การศึกษาพิษณุโลก เขต 2
ตากแดด,ต.วังทรายพูน อ.วังทรายพูน จ.พิจิตร 66180,เขตพื้นที่การศึกษาพิจิตร เขต 1
ต้นชุมแสง,ต.งิ้วราย อ.ตะพานหิน จ.พิจิตร 66110,เขตพื้นที่การศึกษาพิจิตร เขต 2
ตาลเรียง(เชยประชานุกูล),ต.บัวงาม อ.ดำเนินสะดวก จ.ราชบุรี 70130,เขตพื้นที่การศึกษาราชบุรี เขต 2
ตาผา,ต.นครชุมน์ อ.บ้านโป่ง จ.ราชบุรี 70110,เขตพื้นที่การศึกษาราชบุรี เขต 2
ตาล,ต.คุ้งพยอม อ.บ้านโป่ง จ.ราชบุรี 70110,เขตพื้นที่การศึกษาราชบุรี เขต 2
ตาลเตี้ย,ต.ดอนใหญ่ อ.บางแพ จ.ราชบุรี 70160,เขตพื้นที่การศึกษาราชบุรี เขต 2
ตากแดด(รอดประชานุกูล),ต.ดอนคา อ.บางแพ จ.ราชบุรี 70160,เขตพื้นที่การศึกษาราชบุรี เขต 2
ตึกหิรัญราษฎร์(มหาธีรราชอนุสรณ์),ต.เจ็ดเสมียน อ.โพธาราม จ.ราชบุรี 70120,เขตพื้นที่การศึกษาราชบุรี เขต 2
ตะคร้ำเอน,ต.ตะคร้ำเอน อ.ท่ามะกา จ.กาญจนบุรี 71130,เขตพื้นที่การศึกษากาญจนบุรี เขต 2
ตปะโยคาราม,ต.มะขามล้ม อ.บางปลาม้า จ.สุพรรณบุรี 72150,เขตพื้นที่การศึกษาสุพรรณบุรี เขต 1
ตะลุ่ม,ต.มะขามล้ม อ.บางปลาม้า จ.สุพรรณบุรี 72150,เขตพื้นที่การศึกษาสุพรรณบุรี เขต 1
ตาก้อง,ต.ตาก้อง อ.เมืองนครปฐม จ.นครปฐม 73000,เขตพื้นที่การศึกษานครปฐม เขต 1
ตุ๊กตา,ต.บางกระเบา อ.นครชัยศรี จ.นครปฐม 73120,เขตพื้นที่การศึกษานครปฐม เขต 2
ตรีจินดาวัฒนาราม(เฉลิมรัฐราษฎร์นุกูล),ต.บางกุ้ง อ.บางคนที จ.สมุทรสงคราม 75120,เขตพื้นที่การศึกษาสมุทรสงคราม เขต 1
ตะโหนดราย(พรหมสวัสดิ์สาทร),ต.บางกระบือ อ.บางคนที จ.สมุทรสงคราม 75120,เขตพื้นที่การศึกษาสมุทรสงคราม เขต 1
ตาลกง (ธรรมศรียาทร),ต.มาบปลาเค้า อ.ท่ายาง จ.เพชรบุรี 76120,เขตพื้นที่การศึกษาเพชรบุรี เขต 2
ต้นสน ([บุญมีโชติวิทยา),ต.บ้านแหลม อ.บ้านแหลม จ.เพชรบุรี 76110,เขตพื้นที่การศึกษาเพชรบุรี เขต 1
ตรีเอการาม,ต.บางจาก อ.เมืองนครศรีธรรมราช จ.นครศรีธรรมราช 80330,เขตพื้นที่การศึกษานครศรีธรรมราช เขต 1
ตรงบน,ต.คลองกระบือ อ.ปากพนัง จ.นครศรีธรรมราช 80140,เขตพื้นที่การศึกษานครศรีธรรมราช เขต 3
ตรัยรัตนากร,ต.ถ้ำ อ.ตะกั่วทุ่ง จ.พังงา 82130,เขตพื้นที่การศึกษาพังงา เขต 1
ตรณาราม,ต.ท่าข้าม อ.พุนพิน จ.สุราษฎร์ธานี 84130,เขตพื้นที่การศึกษาสุราษฎร์ธานี เขต 2
ตรีธาราราม,ต.ลีเล็ด อ.พุนพิน จ.สุราษฎร์ธานี 84130,เขตพื้นที่การศึกษาสุราษฎร์ธานี เขต 2
ตะพังหม้อ,ต.ปากแตระ อ.ระโนด จ.สงขลา 90140,เขตพื้นที่การศึกษาสงขลา เขต 1
ตาหลวงคง,ต.ชิงโค อ.สิงหนคร จ.สงขลา 90280,เขตพื้นที่การศึกษาสงขลา เขต 1
ตำนาน (วรพัฒนประชาสรรค์),อ.เมืองพัทลุง จ.พัทลุง 93000,เขตพื้นที่การศึกษาพัทลุง เขต 1
ตะโหมด (หมุนคณานุสรณ์),อ.ตะโหมด จ.พัทลุง 93160,เขตพื้นที่การศึกษาพัทลุง เขต 1
ตะแพน,อ.ศรีบรรพต จ.พัทลุง 93190,เขตพื้นที่การศึกษาพัทลุง เขต 1
ตันติการามมิตรภาพที่ 109,อ.ระแงะ จ.นราธิวาส 96130,เขตพื้นที่การศึกษานราธิวาส เขต 3